{
  "$schema": "http://json-schema.org/draft-07/schema#",
  "title": "Known AI Artists Database",
  "type": "object",
  "required": ["schema_version", "updated", "license", "entries"],
  "properties": {
    "schema_version": {
      "type": "string",
      "pattern": "^\\d+\\.\\d+\\.\\d+$",
      "description": "Semantic version of this schema"
    },
    "updated": {
      "type": "string",
      "format": "date",
      "description": "ISO date of last update"
    },
    "license": {
      "type": "string",
      "enum": ["CC0-1.0", "CC-BY-4.0"],
      "description": "License for the database"
    },
    "entries": {
      "type": "array",
      "items": {
        "type": "object",
        "required": ["id", "name", "aliases", "type", "labels", "ai_confidence", "evidence", "added", "verified"],
        "properties": {
          "id": {
            "type": "string",
            "pattern": "^[a-z0-9-]+$",
            "description": "Unique identifier (kebab-case)"
          },
          "name": {
            "type": "string",
            "minLength": 1,
            "description": "Primary artist name"
          },
          "aliases": {
            "type": "array",
            "items": { "type": "string" },
            "description": "Alternative names, handles, spellings"
          },
          "type": {
            "type": "string",
            "enum": ["artist", "project", "collective"],
            "description": "Type of entry"
          },
          "labels": {
            "type": "array",
            "items": { "type": "string" },
            "description": "Associated record labels"
          },
          "ai_confidence": {
            "type": "string",
            "enum": ["high", "medium", "low"],
            "description": "Confidence level of AI generation"
          },
          "evidence": {
            "type": "array",
            "minItems": 1,
            "items": {
              "type": "object",
              "required": ["url", "note", "date", "last_checked", "status"],
              "properties": {
                "url": {
                  "type": "string",
                  "format": "uri",
                  "description": "Source URL"
                },
                "note": {
                  "type": "string",
                  "description": "What this evidence shows"
                },
                "date": {
                  "type": "string",
                  "pattern": "^\\d{4}-\\d{2}$",
                  "description": "YYYY-MM when evidence was published"
                },
                "last_checked": {
                  "type": "string",
                  "format": "date",
                  "description": "YYYY-MM-DD when this URL was last verified"
                },
                "status": {
                  "type": "string",
                  "enum": ["valid", "broken", "outdated"],
                  "description": "Current status of the evidence URL"
                }
              }
            }
          },
          "added": {
            "type": "string",
            "format": "date",
            "description": "ISO date entry was added to DB"
          },
          "verified": {
            "type": "string",
            "format": "date",
            "description": "ISO date entry was last verified"
          }
        },
        "additionalProperties": false
      },
      "uniqueItems": true
    }
  },
  "additionalProperties": false
}